ID,FILE,NAME,NAME_ZH,DESC,DESC_ZH
82f81baccd112658b2f4cc2a4806d63e,Hex Calculator (World) (Ja) (WonderWitch) (Unl).zip,Hex Calculator (World) (Ja) (WonderWitch) (Unl),十六进制计算器（世界版）（日版）（WonderWitch）（未授权）,,
d70316f10f3056f1c0c6b48832950d2a,Honey (World) (Ja) (v0.4) (WonderWitch) (Program) (Unl).zip,Honey (World) (Ja) (v0.4) (WonderWitch) (Program) (Unl),甜心（世界）（日版）（0.4版）（神奇女巫）（程序版）（未授权）,,
6400b3a49772536b8cca7eea5dd61b1a,Hunter X Hunter - Ishi o Tsugu Mono (Japan) (Rev 1).zip,Hunter X Hunter : Ishi wo Tsugu Mono,全职猎人：传承意志之人,"Hunter X Hunter is a Japanese manga series written and illustrated by Yoshihiro Togashi. The story focuses on a young boy named Gon, who discovers that his father, whom he was told was dead, is actually alive and well. He learns that his father, Ging, is",《全职猎人》是由富坚义博创作的日本漫画系列。故事围绕着一个名叫小杰的小男孩展开，他发现原本被告知已去世的父亲实际上还活着，而且过得很好。他得知自己的父亲金……
323f7b42d41ca1900c635d8ad0fa9f3b,Invader DX & Boss DX (World) (Ja) (WonderWitch) (Unl).zip,Invader DX & Boss DX (World) (Ja) (WonderWitch) (Unl),入侵者DX与首领DX（世界版）（日版）（神奇女巫）（未授权）,,
e08673f091fd725460d79ada448e03ca,Jump on Step (World) (WonderWitch) (Unl).zip,Jump on Step (World) (WonderWitch) (Unl),阶梯跳跃（世界版）（神奇女巫）（未授权版）,,
075030e2e6e2a8b224048bf7ea5d992d,Kakutou Ryouri Densetsu Bistro Recipe - Wonder Battle Hen (Japan).zip,Kakutou Ryouri Densetsu Bistro Recipe : Wonder Bat,格斗料理传说 小餐馆食谱：梦幻之战,"Kakutou Ryouri Densetsu Bistro Recipe: Wonder Battle Hen is a Strategy game, developed and published by Banpresto, which was released in Japan in 1999. In a world where talented cooks turn tasty food into monsters called Foodons, amateur chef Zen travels on a world cruise working his way up to win tournaments and become a Foodon champion. Cooking to create a new Foodon requires timed inputs which, if done perfectly, can earn an S-rank which adds an additional skill to the new Foodon. There about 100 different Foodons of types Japanese, Chinese, Western, and Ethnic. Foodons gain experience if they win against opponents in battles. Foodons can also be boosted by toppings that compliments the dish they are based on.",《格斗料理传说 小餐馆食谱：梦幻之战》是一款策略游戏，由万代南梦宫旗下的万普（Banpresto）开发并发行，于1999年在日本发售。在这个世界里，厨艺精湛的厨师能将美味佳肴变成名为“食物兽”的怪物。业余厨师禅开启了环球之旅，他一路参加比赛，努力成为食物兽冠军。烹饪创造新的食物兽需要把握时机进行操作，如果操作完美，就能获得S级评价，为新食物兽增添一项额外技能。大约有100种不同类型的食物兽，包括日式、中式、西式和民族风味。食物兽在战斗中战胜对手就能获得经验。食物兽还可以通过与它们所基于的菜肴相搭配的配料来提升能力。
ca9a312c8a624b7e68202fe19282a7be,Kaze no Klonoa - Moonlight Museum (Japan).zip,Kaze no Klonoa : Moonlight Museum,风之克罗诺亚：月光博物馆,"In this game, you control a boy named Klonoa. One day he sees a dream in which he learns that somebody has stolen a fragment of the moon. He is told that the thieves are probably some painters who took the moon fragment into a museum. As Klonoa enters the music, he gets teleported into a mysterious world. Now he has to use his wit in order to overcome all the obstacles in this world and retrieve the moon fragment.
Kaze no Klonoa: Moonlight Museum is a platform game with an emphasis on puzzle-solving. The enemies you encounter can be inflated with the help of Klonoa's yo-yo, and carried around. You can throw them at other enemies, or use them to jump to higher ledges. In addition, there are various kinds of symbols you have to collect to open locked doors, teleporters, switches, time bombs, and other ingredients for puzzles.","在这款游戏中，你将操控一个名叫克罗诺亚的男孩。有一天，他做了个梦，得知有人偷走了一块月亮碎片。他被告知，小偷可能是一些把月亮碎片带到博物馆的画家。当克罗诺亚走进那片音乐之境时，他被传送到了一个神秘世界。现在，他必须运用自己的智慧，克服这个世界里的所有障碍，找回月亮碎片。
《风之克罗诺亚：月光博物馆》是一款注重解谜的平台游戏。你遇到的敌人可以借助克罗诺亚的溜溜球将其吹胀，然后带着走。你可以把它们扔向其他敌人，或者利用它们跳到更高的平台上。此外，你还必须收集各种符号来打开锁着的门、传送器、开关、定时炸弹以及其他解谜要素。"
247acff34cf425607134243416d6622f,Keiba Yosou Shien Soft - Yosou Shinkaron (Japan).zip,Keiba Yosou Shien Soft : Yosou Shinkaron,赛马预测支援软件：预测新理论,"Yosou Shin Karon is a Horse Racing game, published by Media Entertainment, which was released in Japan in 1999.",《预测新理论》是一款由Media Entertainment发行的赛马游戏，于1999年在日本发售。
2511811ee30527f469410de7628cb812,Kirin Editor + Kuro Pad (World) (Ja) (WonderWitch) (Unl).zip,Kirin Editor + Kuro Pad (World) (Ja) (WonderWitch) (Unl),麒麟编辑器 + 黑记事本（全球版）（日版）（WonderWitch）（未授权）,,
ba3057099c58ab2ac771cd5bc76e36c4,Kiss Communication (World) (Ja) (WonderWitch) (Unl).zip,Kiss Communication (World) (Ja) (WonderWitch) (Unl),亲吻交流,,
0a28e8838534b51e73e90c57c9b7ff1e,Kiss Yori... - Seaside Serenade (Japan) (Rev 2).zip,Kiss Yori... - Seaside Serenade,比亲吻更…… - 海滨小夜曲,"Kiss Yori... Seaside Serenade is an Adventure game, developed by Kid, which was released in Japan in 1999.",《比亲吻更…… - 海滨小夜曲》是一款由Kid开发的冒险游戏，于1999年在日本发售。
0bcd1920e9c8ddf10696e31d4583ce49,Kosodate Quiz - Dokodemo My Angel (Japan).zip,Kosodate Quiz Dokodemo - My Angel,育儿问答 随时随地 - 我的天使,"Kosodate Quiz Dokodemo: My Angel is a Trivia / Game Show game, developed by Namco and published by Bandai, which was released in Japan in 1999.",《育儿问答 随时随地：我的天使》是一款问答/游戏秀类型的游戏，由南梦宫（Namco）开发，万代（Bandai）发行，于1999年在日本发售。
82f4b37aa51c5b4cdb3f4ebcc4cd5fca,Kyousouba Ikusei Simulation - Keiba (Japan) (Rev 1).zip,Kyousouba Ikusei Simulation : Keiba,竞马场育成模拟：赛马,"This game begins by asking you to name your own stable, and then your first horse, quickly introducing you to the world of this horse raising, breeding, and racing game. The majority of the gameplay focuses on micromanaging your horses training and care. You an select the races that you think you're horse is ready for in an attempt to win coveted ribbons, and wealth beyond the dreams of avarice!
Once you enter a race you'll be taken out of control and see if all you're hard work has payed off as your beast makes it around the track. An announcer follows the competition of there Muybridge wannabes, narrating what you see.
Regardless how good your horse is it will be economically prudent to continue its line. Through shrewd husbandry you can translate the positive traits of race horse to a new generation. You'll be able to select a proper mate from other stables. 
Horse information and stable data can be shared with other players via the Communication Cable.","这款游戏一开始会让你为自己的马厩命名，接着为你的第一匹马取名，迅速带你进入这个养马、繁育和赛马的游戏世界。

游戏的大部分玩法都集中在对马匹训练和照料的精细管理上。你可以挑选你认为马匹已准备好参加的比赛，努力赢取令人梦寐以求的缎带和超乎想象的财富！

一旦你让马匹参赛，你就无法再操控，只能看着你的骏马在赛道上奔跑，看看你所有的辛勤付出是否有了回报。一位解说员会跟进这些“穆伊布里奇模仿者”的比赛，为你所看到的场景进行解说。

无论你的马有多优秀，从经济角度考虑，延续它的血脉都是明智之举。通过精明的繁育管理，你可以将赛马的优良特质传承给新一代。你可以从其他马厩中挑选合适的配偶。

马匹信息和马厩数据可以通过通信线与其他玩家共享。"
db393bc427d0bc83d11482e25282e296,Langrisser Millennium WS - The Last Century (Japan) (Rev 1).zip,Langrisser Millennium WS : The Last Century,兰古瑞萨千年纪WS：最后的世纪,"""Langrisser Millennium"" is yet another installment of the long-running Japanese strategy RPG series. You control five main characters: Taji, a young boy whom was chosen as the ruler of the country Salem; Nei Lee Sun, the ruler of Chin, who helps Taji when he gets involved in a war; Masariva, a half-beast and a former slave who became a queen, but preferred the life of a wanderer; Rumaty Marf, the queen of the country Misla, on a quest for an angel who appeared in her dream; and Saryune, the ruler of Vidern, whose only desire is power. Those five rulers meet each other, when they get involved in a war with hostile countries. However, soon they learn a greater evil has appeared in the world - they must reach a faraway island to prevent the reincarnation of an evil god...
The gameplay ""Langrisser Millenium"" is divided into ""Map Mode"" and ""Battle Mode"". In map mode, you move your characters over a map, trying to reach enemy fortresses and to prevent the enemy to reach yours. Everything happens in real time: if you do nothing, the enemy will come and conquer your country. Once in battle mode, you control several teams. You only assign actions to the team leaders, while others fight automatically in round-based strategy combat.",\
f58275caa3dcb0f6aa18022fc818d490,Last Stand (Japan).zip,Last Stand,最后防线,"Last Stand is a Strategy game, developed by Soft Machine and published by Bandai, which was released in Japan in 1999.",《最后防线》是一款策略游戏，由Soft Machine开发，万代发行，于1999年在日本发售。
014f6ac3c4b3d7adae89768e77ce81ac,LifeGame for WonderWitch (World) (WonderWitch) (Unl).zip,LifeGame for WonderWitch (World) (WonderWitch) (Unl),奇妙女巫的生命游戏（全球版）（奇妙女巫）（未授权）,,
2869c91584305e1f18b0754d570a859e,Lode Runner for WonderSwan (Japan).zip,Lode Runner for WonderSwan,神奇天鹅掌机版淘金者,"The Bungeling Empire has stolen a huge cache of gold from its rightful owners, and your mission is to infiltrate its treasury and recapture it. This entails progressing through 150 screens of platforms, ladders and ropes.
The Empire has sent robotic guards down to protect the gold, and contact with any of these will cost you a life. Your method of escaping them is to press fire to dig a hole in their line of movement, thus causing them to fall in briefly, allowing you to move across the gap safely. Once all the gold has been collected, a ladder allowing you to move onto the next screen is added. Completing these screens often requires forward planning and precision.
This was one of the earliest games to include a level editor, allowing the creation of new level designs with no programming skill.","邦格林帝国从合法所有者手中偷走了大量黄金，你的任务是潜入其金库并夺回这些黄金。这需要你通过150个包含平台、梯子和绳索的关卡。
帝国派遣了机器人警卫来保护黄金，一旦与任何一个警卫接触，你就会失去一条生命。你摆脱它们的方法是按下射击键，在它们的移动路线上挖一个洞，使它们暂时掉进去，这样你就可以安全地穿过缺口。当所有的黄金都被收集完毕后，会出现一个梯子，让你进入下一个关卡。完成这些关卡通常需要提前规划和精准操作。
这是最早包含关卡编辑器的游戏之一，无需编程技能即可创建新的关卡设计。"
148adc2dd8bf8bb1488cdd07f85d29e7,"Long Vowel, The (World) (Ja) (Demo) (WonderWitch) (Unl).zip","Long Vowel, The (World) (Ja) (Demo) (WonderWitch) (Unl)",长元音（世界版）（日版）（试玩版）（WonderWitch）（未授权）,,
ab52475bbe5a60ff3c879b843c184fd2,Mac the Speed Shooter (World) (Proto) (WonderWitch) (Unl).zip,Mac the Speed Shooter (World) (Proto) (WonderWitch) (Unl),极速射手麦克（全球版）（原型版）（WonderWitch）（未发行）,,
bc8f16c2db2c0fa1a840375ced60995e,Macross - True Love Song (Japan).zip,Macross : True Love Song,超时空要塞：真爱之歌,"Macross: True Love Song is a Strategy game, developed and published by Lay-Up, which was released in Japan in 2000.",《超时空要塞：真爱之歌》是一款策略游戏，由Lay-Up开发并发行，于2000年在日本发售。
64d5462bd6f6d3aa42b62bca44684e40,Magical Drop for WonderSwan (Japan).zip,Magical Drop for WonderSwan,魔法水滴 万代掌机版,"Somewhere in the world, there is a precious item called magical drop. Anyone who finds it will be granted happiness, or will be able to execute revenge upon his enemy. No wonder many people are trying to get this item. But the way to obtain it is not easy...
This is a puzzle game in which different balloons are falling down and you must match three balloons of the same type to make them disappear and to prevent them from crushing you. The player character is running sideways on the bottom of the top-down screen, and is shooting the balloons to make them change shapes and match each other. There are different player characters, all of which are Tarot cards: Demon, Justice, Priestess, etc. Each character shoots a different kind of special ball, which can be matched against any combination of other two.","在世界的某个地方，有一种名为魔法水滴的珍贵物品。任何找到它的人都将获得幸福，或者能够向敌人复仇。难怪许多人都想得到这个物品。但获得它的方法并不容易……
这是一款益智游戏，不同的气球会不断落下，你必须将三个相同类型的气球匹配在一起，让它们消失，以免被它们压垮。玩家角色会在俯瞰视角屏幕的底部左右移动，并发射气球，使其变形并相互匹配。有不同的玩家角色，他们都是塔罗牌形象：恶魔、正义、女祭司等等。每个角色都会发射一种不同的特殊球，这种特殊球可以与其他任意两个气球组合相匹配。"
5d9552ba3283b16ff708a5ebd9f0eab3,Mahjong Touryuumon (Japan) (Rev 1).zip,Mahjong Touryuumon,麻将游览门,"Mahjong Touryuumon is a Board game, developed by Chat Noir and published by Sammy Studios, which was released in Japan in 1999.",《麻将游览门》是一款由黑猫工作室（Chat Noir）开发、山米工作室（Sammy Studios）发行的桌面游戏，于1999年在日本发售。
7266921e87496b645178582e08949de0,Makaimura for WonderSwan (Japan).zip,Makaimura for WonderSwan,魔界村 神奇天鹅版,"Arthur the brave knight must rescue his beloved Princess Prin-Prin from the Demon Emperor Azazel and his forces. Among them are various undead (ghosts, zombies), bats, ogres and goblins. Other challenges include moving platforms, ladders and water/fire hazards. This game combines enemies from all three previous Ghosts 'N Goblins games.",勇敢的骑士亚瑟必须从恶魔皇帝阿撒兹勒及其手下的魔军手中救出他心爱的普琳普琳公主。魔军中有各种各样的不死生物（幽灵、僵尸）、蝙蝠、食人魔和妖精。其他挑战还包括移动平台、梯子以及水/火危险区域。这款游戏集合了前三部《幽灵与妖精》系列游戏中的敌人。
2cf33eea4d26941752a870a9509f1bb8,Medarot Perfect Edition - Kabuto Version (Japan).zip,Medarot Perfect Edition : Kabuto Version,金属机器人完美版：独角仙版,"Medarot: Perfect Edition is a RPG developed by Natsume and published by Imagineer in 1999 for the WonderSwan, and is a ""director's cut"" edition of the original game released on the Nintendo Game Boy in 1997. 
It follows Hikaru Agata on his quest to compete in Robottle tournaments and defeat the evil Roborobo Gang. It was released in two versions: Kabuto (Rhinoceros beetle), where the player's starting Medarot is Metal Beetle, and Kuwagata (Stag beetle), where the player starts with Head Scissors.","《金属机器人：完美版》是一款由夏目社开发、Imagineer于1999年为万代神奇天鹅掌机发行的角色扮演游戏，它是1997年在任天堂Game Boy上发行的原版游戏的“导演剪辑版”。
它讲述了赤田光在机器人对战锦标赛中参赛并击败邪恶的机器机器人团伙的冒险故事。该游戏有两个版本：独角仙版，玩家初始的金属机器人是金属甲虫；锹形虫版，玩家初始的金属机器人是剪刀头。"
4dd147e44616894c02750cd4546118f8,Medarot Perfect Edition - Kuwagata Version (Japan).zip,Medarot Perfect Edition : Kuwagata Version,金属机器人完美版：锹形虫版,"Medarot: Perfect Edition is a RPG developed by Natsume and published by Imagineer in 1999 for the WonderSwan, and is a ""director's cut"" edition of the original game released on the Nintendo Game Boy in 1997. 
It follows Hikaru Agata on his quest to compete in Robottle tournaments and defeat the evil Roborobo Gang. It was released in two versions: Kabuto (Rhinoceros beetle), where the player's starting Medarot is Metal Beetle, and Kuwagata (Stag beetle), where the player starts with Head Scissors.","《金属机器人：完美版》是一款由夏目社开发、Imagineer于1999年为万代神奇天鹅掌机发行的角色扮演游戏，它是1997年在任天堂Game Boy上发行的原版游戏的“导演剪辑版”。
它讲述了赤田光参加机器人大战锦标赛并击败邪恶的机器机器人团伙的冒险故事。该游戏有两个版本：独角仙版（玩家初始的金属机器人是金属甲虫）和锹形虫版（玩家初始的金属机器人是剪刀头）。"
b49a16926da386913c06ee3d588b98fd,Meitantei Conan - Majutsushi no Chousenjou! (Japan).zip,Meitantei Conan : Majutsushi no Chousenjou!,名侦探柯南：魔术师的挑战状！,"Conan Edogawa is the pseudonym of Shin'ichi Kudo, but more than just a pseudonym, a pseudoform. Shin'ichi Kudo, an inquisitive seventeen year old student, was investigating a blackmail case when attacked by members of the Black Organization. He was forced to take an experimental APTX 4869 drug which caused, in a rare side-effect, his body to transform into that of a seven-year-old. 
This does not stop Shin'ichi, adopting the name Conan Edogawa he moves in with Ran Mori, his childhood friend and sweetheart. Enrolling in a elementary school to complete his disguise he vows to find out who is backing the Black Organization, and to have his revenge. With the help of his his oddball classmates, an ex-member of the Black Organization Ai Haibara, whose also been turned into a child, and his beloved he just might do it...
The games story follows the Conan through his school life which intertwines with his search for justice. He forms a Junior Detective League in his school to help him out. This cast of characters will help supply you information throughout the game.
The gameplay consists of using a map screen to travel to a number of areas collecting clues for the case you are on. Each area offers you the ability to examine the area, talk to bystanders, collect items, and sometimes attack if a threat is apparent. 
After collecting information you will have the chance to open your notebook, which will cause the WonderSwan to switch to a vertical orientation, and review your information. Also in the note books is a logic grid. On the grid you will have to select where you've deduced something intersects,who was at the scene at what time, by marking it with a circle and voiding all impossibilities with crosses. Once you've completed an entire grid you'll be able to present your deductions or press a point further allowing you to progress. If you've gotten your reasoning wrong, however, it is back to the drawing board and time to recheck you evidence and maybe time to see if you missed some clues.
This game includes five scenarios, roughly translated to English as:
1. Continuous high school girl kidnapping
2. Murder on the suspense drama set
3. Jack the Ripper murder
 
The mysteries incident's letter of notice
4. Treasure cases at the end of the century","江户川柯南是工藤新一的化名，但这不仅仅是个化名，更是一种伪装形态。工藤新一是个充满好奇心的十七岁学生，他在调查一起敲诈勒索案时遭到了黑衣组织成员的袭击。他被迫服用了实验性药物APTX4869，这种药物产生了罕见的副作用，使他的身体变成了七岁小孩的模样。

这并没有阻止新一，他化名江户川柯南，住进了儿时好友兼恋人毛利兰的家中。为了完善伪装，他进入一所小学就读，并誓言要找出黑衣组织的幕后主使，为自己报仇。在他那些古怪同学的帮助下，还有同样变成小孩的黑衣组织前成员灰原哀以及他心爱的人，他或许能够实现这个目标……

游戏的故事围绕着柯南的校园生活展开，同时也穿插着他对正义的追寻。他在学校成立了少年侦探团来协助自己。在整个游戏过程中，这些角色会为你提供信息。

游戏玩法包括使用地图界面前往多个区域，为你正在调查的案件收集线索。每个区域都允许你检查现场、与旁观者交谈、收集物品，有时如果有明显的威胁还可以进行攻击。

收集完信息后，你将有机会打开笔记本，此时万代WonderSwan掌机会切换到竖屏模式，你可以查看收集到的信息。笔记本中还有一个逻辑表格。在表格中，你必须通过画圈标记出你推断出的交叉点，即某人在某个时间出现在现场的情况，并通过打叉排除所有不可能的情况。一旦你完成了整个表格，你就可以提出你的推理，或者进一步强调某个要点，从而推动游戏进程。然而，如果你推理错误，就必须重新开始，重新检查证据，也许还得看看是否遗漏了一些线索。

这款游戏包含五个场景，大致翻译成英文如下：
1. 连续高中女生绑架案
2. 悬疑剧片场谋杀案
3. 开膛手杰克谋杀案
神秘事件通知信
4. 世纪末的宝藏案件"
e145af5b6ceff894cddff7e6c21601fd,Meitantei Conan - Nishi no Meitantei Saidai no Kiki! (Japan).zip,Meitantei Conan : Nishi no Meitantei Saidai no Kiki,名侦探柯南：西部名侦探最大危机,"Detective Conan returns to the WonderSwans continuing his efforts to thwart the dreaded Black Organization. The game features new mysteries and new characters from the Conan universe. 
New features include finding keys. Keys represent actual bits of evidence you can use to solve the logic puzzles in the game once you find all the keys you will be able to attempt to solve the puzzle. However, often in the search for keys one finds hints. Hints are bits of information that will point you in the right direction of a key. Hints also be presented, singularly or combined, to various people in an attempt to extract information, or keys. Once you have all the keys you will be able to have an entire logic grid, otherwise there will be grayed out areas on the grid.
There is also now a mode in some cases where Conan will have to chase the suspect through several areas before subduing him. 
The game records your information at the start of the game to work a character based off of you into the game. This character can be swapped with other owners of 
Meitantei Conan: Nishi no Meitantei Saidai no Kiki !? through the Communication Cable.
This game alternates between horizontal display for regular play and investigation, and vertical display for Conan's detective notebook.","名侦探柯南回归到WonderSwan平台，继续努力挫败可怕的黑衣组织。游戏包含了柯南世界中的新谜团和新角色。
新功能包括寻找钥匙。钥匙代表着实际的证据，一旦你找到所有钥匙，就可以用来解开游戏中的逻辑谜题。然而，在寻找钥匙的过程中，常常会发现线索。线索是能为你指明找到钥匙的正确方向的信息。线索也可以单独或组合起来呈现给不同的人，以试图获取信息或钥匙。一旦你拥有了所有钥匙，就可以得到完整的逻辑网格，否则网格上会有灰色区域。
在某些情况下，现在还有一种模式，柯南必须在几个区域中追捕嫌疑人，然后将其制服。
游戏在开始时会记录你的信息，以便将基于你的角色融入游戏。这个角色可以通过通信线与其他《名侦探柯南：西部名侦探最大危机》的玩家进行交换！
这款游戏在常规游玩和调查时采用横向显示，而在查看柯南的侦探笔记时则采用纵向显示。"
005434ee2b966c00907c4a7469a5e87f,Metakomi Theraphy - Nee Kiite! (Japan).zip,Metakomi Theraphy : Nee Kiite!,潜入治疗：嘿，听着！,"Metakomi Theraphy: Nee Kiite! is a Strategy game, developed by Yoshidayama Workshop and published by Media Entertainment, which was released in Japan in 2000.",《潜入治疗：嘿，听着！》是一款策略游戏，由吉田山工作室开发，媒体娱乐公司发行，于2000年在日本发售。
