ID,FILE,NAME,NAME_ZH,DESC,DESC_ZH
131558ad5a8bdfdf9280b694a0515ae5,Digimon Adventure - Cathode Tamer (Japan).zip,Digimon Adventure : Cathode Tamer,数码宝贝大冒险：阴极驯兽师,"This is the second game in Digimon Adventure series, a kind of an add-on to  Anode Tamer. The game is based on the popular manga Digimon. The hero, a boy named Ryou, has to travel to digital world in order to free his friends from the clutches of the evil digital monster Milenniamon.
The story of this game is identical to that of ""Anode Tamer"", and gameplay mechanics are exactly the same: you descend into dungeons to fight monsters in turn-based style, capture the monsters after the battles and then send them to fight new ones. The difference between the two games are the monsters themselves: ""Cathode Tamers"" features a brand new set of monsters, and since the beginning of the game you encounter different foes. The full collection of monsters can be achieved only if you complete both games.","这是《数码宝贝大冒险》系列的第二款游戏，是《阳极驯兽师》的一种资料片。该游戏基于热门漫画《数码宝贝》改编。主角是一个名叫辽的男孩，他必须前往数码世界，将他的朋友们从邪恶数码怪兽千年兽的魔掌中解救出来。
这款游戏的剧情与《阳极驯兽师》相同，游戏机制也完全一样：你深入地下城，以回合制方式与怪物战斗，战斗结束后捕获怪物，然后派它们去挑战新的怪物。两款游戏的区别在于怪物本身：《阴极驯兽师》拥有全新的怪物阵容，从游戏开始你就会遇到不同的敌人。只有完成这两款游戏，才能集齐所有怪物。"
5ec77dc3ba385e26172e3ab6e38fef33,Digimon Adventure 02 - Tag Tamers (Japan) (Rev 1).zip,Digimon Adventure 02 : Tag Tamers,数码宝贝大冒险02：搭档驯兽师,"The game is based on the manga series Digimon, in which children can travel to a digital world and help good digital monsters to defeat evil ones. In this game, the two heroes, Ryou and Ken, are summoned to the Digiworld to fight against the archenemy Millenniumon and his side-kick Diablomon. Upon defeating the two evil monsters once again, the heroes realize that Millenniumon has taken a different shape and is reborn to conquer the Digiworld anew. Now you must recruit digital monsters and lead them into the ultimate battle.
The gameplay follows traditional Digimon outlines: you descend into dungeons and have your monster friends fight other monsters in turn-based combat. Upon returning to the town, you can make those monsters participate in future battles. Unlike the two previous Digimon Adventure games,  Anode and  Cathode Tamers, you cannot move over the battle field.","这款游戏基于漫画系列《数码宝贝》改编，在该系列中，孩子们可以前往数码世界，帮助善良的数码怪兽击败邪恶的数码怪兽。在这款游戏中，两位主角辽和健被召唤到数码世界，与宿敌千年兽及其帮凶恶魔兽展开战斗。再次击败这两只邪恶怪兽后，主角们发现千年兽已改头换面，重生后企图再次征服数码世界。现在，你必须招募数码怪兽，并带领它们投入最终决战。
游戏玩法遵循传统的《数码宝贝》模式：你深入地下城，让你的怪兽伙伴在回合制战斗中与其他怪兽交锋。回到城镇后，你可以让这些怪兽参与未来的战斗。与前两款《数码宝贝大冒险》游戏《阳极驯兽师》和《阴极驯兽师》不同的是，你无法在战场上移动。"
2f1e33de3a5f7f47734038370b3bbfaf,Digital Partner (Japan).zip,Digital Partner,数字伙伴,"Digital Partner is a Strategy game, developed by Tom Create and published by Bandai, which was released in Japan in 2000.",《数字伙伴》是一款策略游戏，由Tom Create开发，万代发行，于2000年在日本发售。
9a50b0db9a006047100ed3a00ebd4234,Dokodemo Hamster (Japan).zip,Dokodemo Hamster,随时随地的仓鼠,"In this game, you are the owner of a hamster. Your hamster is inside a cage, and is living its life in real time, regardless of your actions, walking around, sleeping, etc. However, you can do many things to help your hamster feel better. There is a list of topics you can ""discuss"" with the hamster: for example, you can order it to run inside a wheel, or ask it whether it is hungry or not. You can feed it some typical hamster food, clean the cage from time to time, and even write e-mails to your hamster. Depending on your actions the disposition of the hamster will change.",在这款游戏中，你是一只仓鼠的主人。你的仓鼠待在笼子里，无论你做什么，它都在实时地生活着，四处走动、睡觉等等。不过，你可以做很多事情来让你的仓鼠感觉更舒适。有一系列你可以和仓鼠“讨论”的话题：例如，你可以命令它在滚轮里跑步，或者询问它是否饿了。你可以给它喂一些常见的仓鼠食物，时不时清理一下笼子，甚至还能给你的仓鼠写电子邮件。仓鼠的性情会根据你的行为而发生变化。
1216f02ec99e78aa54c8127c2b7f6036,D's Garage 21 Koubo Game - Tane o Maku Tori (Japan).zip,D's Garage 21 Koubo Game : Tane wo Maku Tori,D氏车库21工坊游戏：播撒种子的鸟,"The raven has made a friend. But sorrow be to this raven, for this fellow avian migrates, and will not return for seasons. Filled with sadness and regret the raven takes wing. As he soars through his lonely world his tears begin to fall... and water dying flowers. At last he knows what he must do until his friend returns, he will make new friends in the flowers. He will help them grow and spread their seeds. 
Each level in Tane wo Maku Tori contains four pillars bridged by a series of horizontal or vertical rows. These rows are different for each of the three spaces formed by the pillar. The rows may be moved up and down, one set at a time. At the foot of a column, up to three in harder areas, will be a nascent flower. Water drops will fall along the path of the pillars, which will have a different theme for each level, and eventually either fall onto the ground or a flower. Water drops will always move along a bridge if it intersects their path, drops can't go up diagonals. Drops an combine to create larger faster moving drops. Any more than three drops and it will simply fall off the pillar, or bridge, and be of no use.
When a flower gets enough rain drops, or tear drops, it will bloom, when all the flowers on the stage bloom it will be cleared. 
Enemies also roam the stage, gobbling up hydrogen based solution and plants. They follow the same laws as the drops and will move along beams when encountered, however they can go up vertical beams. Should one reach a flower it will nibble at it until dead. This ends the game; however, enemies can be destroyed by three drops combined. 
A time mode is available where the player picks a difficulty level and then plays on the level until a flower is eaten or they run out of time, each completed flower will add to the time. 
A two player mode is available through the Communication Cable
This game is played vertically.","这只乌鸦交了个朋友。但这只乌鸦很悲伤，因为它的这位鸟类伙伴要迁徙了，好几个季节都不会回来。满心悲伤与遗憾的乌鸦振翅高飞。当它在这孤寂的世界中翱翔时，泪水开始滑落……滋润着濒临枯萎的花朵。最终，它明白了在朋友归来之前自己必须做些什么——它要在花丛中结交新朋友。它要帮助花朵生长、传播种子。
《播撒种子的鸟》的每一关都有四根柱子，由一系列水平或垂直的排连接起来。由柱子形成的三个空间，每个空间的排都各不相同。这些排可以一次移动一组，上下移动。在柱子底部，在较难的区域最多会有三株初绽的花朵。水滴会沿着柱子的路径落下，每一关的柱子都有不同的主题，水滴最终要么落到地面，要么落到花朵上。如果水滴的路径与桥相交，它们总会沿着桥移动，水滴不能沿对角线向上移动。水滴可以合并形成更大、移动更快的水滴。如果超过三滴水，它们就会直接从柱子或桥上掉落，毫无用处。
当一朵花得到足够的雨滴或泪滴时，它就会绽放，当舞台上所有的花都绽放时，这一关就通关了。
敌人也会在舞台上四处游荡，吞食以氢为基础的溶液和植物。它们和水滴遵循同样的规则，遇到横梁时会沿着横梁移动，不过它们可以沿着垂直的横梁向上移动。如果有敌人碰到一朵花，它会一直啃咬，直到花死去。这就意味着游戏结束；不过，三滴水合并可以消灭敌人。
游戏有计时模式，玩家可以选择一个难度级别，然后在该关卡中游戏，直到有一朵花被吃掉或时间耗尽，每成功让一朵花绽放都会增加时间。
通过通信电缆可以开启双人模式。
这款游戏是竖屏游玩的。"
927b5138f646c0b14bf7f38b49c2b6bc,EF-Cribbage (World) (Ja) (v0.28) (Proto) (WonderWitch) (Unl).zip,EF-Cribbage (World) (Ja) (v0.28) (Proto) (WonderWitch) (Unl),EF-克里比奇纸牌游戏（全球版）（日语版）（0.28版）（原型）（WonderWitch制作）（未授权）,,
8c6267149efabc782f1208beb01346a8,Engacho! for WonderSwan (Japan).zip,Engacho! for Wonderswan,Engacho！（万代掌机版）,"Engacho is based on a popular Japanese children game. You play a little boy named Sunzuki, who wants to prove to his angry father that he is not a coward and can stand up against the terrible monsters of the Oops Five group. Those five guys are extremely ugly and can contaminate you with an awful disease the moment they touch you. So you should outsmart them and run away before they can catch you. The gameplay is turn-based.",Engacho 改编自一款广受欢迎的日本儿童游戏。你将扮演一个名叫巽月（Sunzuki）的小男孩，他想向愤怒的父亲证明自己不是懦夫，能够对抗“糟糕五人组”的可怕怪物。那五个家伙长得极其丑陋，一旦碰到你，就会让你染上可怕的疾病。所以你要比他们聪明，在被他们抓住之前赶紧逃跑。游戏采用回合制玩法。
736f97152eac8abbc0ca40b2610eb894,Fever - Sankyo Koushiki Pachinko Simulation for WonderSwan (Japan).zip,Fever : Sankyo Koushiki Pachinko Simulation,狂热：三协官方弹珠机模拟,"Fever is a pachinko simulator. Pachinko is a Japanese  cross between a pinball case and a slot machine. This game supplies the player with a number of different pachinko machines, with rotating slot numbers. These can be either in a classic form of rotating wheels or an interactive digital screen. As the balls pop around the pachinko machine they'll land in different areas and effect your earnings. The player can always choose the speed at which balls are being launched onto the field which will change how they land.
This simulator also has a collection hall where the player can use his pachinko earnings to buy gambling machines and related memorabilia. These can be viewed along with information about their history.","《狂热》是一款弹珠机模拟器。弹珠机是日本的一种结合了弹珠台和老虎机特点的游戏。这款游戏为玩家提供了多种不同的弹珠机，带有转动的老虎机数字。这些数字可以呈现在经典的转动轮盘上，也可以显示在交互式数字屏幕上。当弹珠在弹珠机里四处弹射时，它们会落在不同的区域，从而影响你的收益。玩家可以随时选择将弹珠发射到游戏区域的速度，这会改变弹珠的落点。
这个模拟器还有一个收藏馆，玩家可以用玩弹珠机获得的收益购买赌博机及相关纪念品。玩家可以查看这些物品，并了解它们的历史信息。"
8cdbec50ddd2d355dc63e99a19ee30a7,Final Lap 2000 (Japan).zip,Final Lap 2000,最终冲刺2000,"Final Lap 2000 is the first hand-held incarnation of Namco's Final Lap racing games. 
This version presents a number of modes, a track building feature, and only one vehicle; an open-wheel car.
The modes are as follows:
1. World Tour: in the mode the player will compete against five other racers and progress through many tracks located around the world. Although the graphics are not  very descriptive of location, the course's shape and curves will always change.
2. Arcade: in this classic mode you'll race against a single opponent through one of the many global tracks of your choosing.
3. Time Trial: here the player will attempt to make the best time on a course of his choosing. The player is the only car on the track for this mode.
The track editing feature can only be used to make simple tracks at the start of the game; however, playing the World Tour will unlock new track parts based on your performance. Using the communication cable players can transfer tracks between different copies of Final Lap 2000.","《最终冲刺2000》是南梦宫《最终冲刺》系列赛车游戏的首款掌机版本。
此版本提供了多种模式、赛道建造功能，且只有一种载具：单座敞篷赛车。
模式如下：
1. 世界巡回赛：在该模式中，玩家将与其他五名赛车手竞争，并在世界各地的众多赛道上展开角逐。尽管画面未能很好地体现出赛道的地理位置，但赛道的形状和弯道总会有所变化。
2. 街机模式：在这个经典模式中，你可以选择全球众多赛道中的一条，与一名对手展开比赛。
3. 计时赛：玩家将尝试在自己选择的赛道上跑出最佳成绩。在该模式下，赛道上只有玩家这一辆车。
游戏开始时，赛道编辑功能只能用于创建简单的赛道；不过，在世界巡回赛模式中，根据你的表现，你将解锁新的赛道部件。使用通信电缆，玩家可以在不同的《最终冲刺2000》游戏卡带之间传输赛道。"
cdb57d91b4733a73f7183f0f4a86c57e,Fire Pro Wrestling for WonderSwan (Japan) (Rev 5).zip,Fire Pro Wrestling for WonderSwan,火焰职业摔跤 万代掌机版,"The first North American release of the Fire Pro Wrestling series comes to the Game Boy Advance.
Fire Pro Wrestling has a stacked roster, comprised of many not-quite-copyright-infringing wrestlers like ""The Bionic Man"" Steve Majors (""Stone Cold"" Steve Austin) and Axe Duggan (Hulk Hogan), making WCW vs. WWF vs. ECW matches possible.  The controls are much more than the typical ""mash buttons until something happens"" that were so popular in earlier wrestling games, instead relying on timing to properly execute a move or hold.","火焰职业摔跤系列首次在北美地区登陆Game Boy Advance掌机。
火焰职业摔跤拥有庞大的选手阵容，其中包含许多未构成版权侵权的摔跤手，比如“生化人”史蒂夫·梅杰斯（对应“冷石”史蒂夫·奥斯汀）和阿克斯·达根（对应浩克·霍根），这使得WCW（世界冠军摔角）、WWF（世界摔角联盟）和ECW（极端冠军摔角）之间的对决成为可能。 游戏的操作远不止早期摔跤游戏中常见的“狂按按钮直到有动作发生”，而是依靠时机来正确执行招式或控制对手。"
21e5673d1daba12ea29a824d1e06c039,Fishing Freaks - Bass Rise for WonderSwan (Japan).zip,Fishing Freaks : BassRise for WonderSwan,钓鱼狂人：鲈鱼崛起 万代神奇天鹅版,"Following in the footsteps of the fishing simulation/rpg Bass Rise this portable remake. Although one can no longer select the gender of  the character there  still remains a great variety of lures and poles to select. As well as five locations. Once a location has been selected a prompt to fill the tacklebox with the lures that and rod that might be most appropriate for the environment. The player then selects where to want to stand on the shore and then the ideal location for a cast.
The view then switches to a closer overhead of the body of water and the player's avatar. A power meter sways over head and should the play manage to stop the meter at just the right point he will be rewarded with his cast going closer to where he intended. Once in the water the player's lure will always be in the center of the screen.
Catching fish is no easy matter as the PlayStation version frequently points out; it is all about finesse. The player will have to entice the fish with wiggles and jolts from the lure... this is of course assuming that the player has selected the right lure. Once a fish is caught a small screen will pop up within the screen, showing a close up of the fish's shadow on the surface of the water. The player will get a chance to see if he hooked something good should the fish jump, as they reel it in.
Records can be shared by means of the Communication Cable.","这款便携重制版游戏延续了钓鱼模拟/角色扮演游戏《鲈鱼崛起》的风格。尽管玩家不能再选择角色的性别，但仍有各种各样的鱼饵和钓竿可供选择，还有五个钓鱼地点。一旦选定地点，游戏会提示玩家用可能最适合该环境的鱼饵和钓竿装满钓具盒。然后玩家选择站在岸边的位置，接着确定理想的抛竿位置。
随后视角切换到水域和玩家角色的近景俯瞰画面。一个力量计量表在上方摆动，如果玩家能在恰到好处的时机停止计量表，抛竿就会更接近他预期的位置。鱼饵入水后，会始终位于屏幕中央。
正如 PlayStation 版本经常指出的，钓鱼绝非易事，关键在于技巧。玩家必须通过鱼饵的摆动和抖动来吸引鱼……当然，这是在玩家选对了鱼饵的前提下。一旦钓到鱼，屏幕上会弹出一个小窗口，显示水面上鱼的影子特写。当玩家收线时，如果鱼跃出水面，就能知道自己是否钓到了好东西。
玩家可以通过通信线分享钓鱼记录。"
65485a44c6ed848548799615a8e6ea1c,From TV Animation One Piece - Mezase Kaizoku Ou! (Japan).zip,From TV Animation One Piece : Mezase Kaizoku Ou!,电视动画《海贼王》：目标是海贼王！,"From TV Animation One Piece: Mezase Kaizoku Ou! is an Adventure game, developed and published by Bandai, which was released in Japan in 2000.",电视动画《海贼王》：目标是海贼王！是一款冒险游戏，由万代开发并发行，于2000年在日本发售。
a33aa98fef0cee5c16d15f1f17f51e73,Frontier (World) (Ja) (WonderWitch) (Unl).zip,Frontier (World) (Ja) (WonderWitch) (Unl),边境（世界）（日版）（WonderWitch）（未发行）,,
c9ade8cb0ee7bcf31eafce6e9490f2e5,Ganso Jajamaru-kun (Japan).zip,Ganso Jajamaru-kun,原创忍者小贾贾,"Ganso JaJaMaru-kun is a remake of the NES platformer Ninja JaJaMaru-kun. It includes new levels and bosses that stretch the gameplay in novel ways. 
Lord Namazu Dayuu has kidnapped JaJaMaru-kun's beloved Princess Sakura. This piratical lord is no laughing matter, despite his sadistically gleeful disposition, he possess an army of creatures drawn from Japanese folklore to prevent you from reuniting with your princess ever again.","《原创忍者小贾贾》是NES平台游戏《忍者小贾贾》的重制版。它包含新关卡和新BOSS，以新颖的方式拓展了游戏玩法。

鲶鱼大人绑架了小贾贾心爱的樱花公主。这位海盗领主可不好对付，尽管他有着残忍的愉悦性情，但他拥有一支由日本民间传说中的生物组成的军队，阻止你与公主再次团聚。"
53ed192cf0644f55127a6e2c483e1a07,GB Yu-Gi-Oh Database (World) (Ja) (WonderWitch) (Unl).zip,GB Yu-Gi-Oh Database (World) (Ja) (WonderWitch) (Unl),GB 游戏王数据库（全球版）（日版）（WonderWitch）（未授权）,,
62c60767302f23d4746b8477a26b71e9,Gomoku Narabe & Reversi - Touryuumon (Japan).zip,Gomoku Narabe & Reversi : Touryuumon,五子棋与黑白棋：流浪门,"A simple collection of two classic puzzle games Gomoku Narabe & Reversi/Othello.
Gomoku Narabe, is a ancient Japanese game the title of which means ""five stones in a row"". The goal of the game is to place five tokens of your color (white or black) in a row. Of course your opponent will be trying to block you. The game ends when  a player achieves tis penta-worthy task. The board is 14 x 14.
Reversi is a game commonly know under the name that it is marketed by Pressman, Othello. In reversi ones goal is to flip the opponents tiles (white or black) by surrounding the opposing token(s) on either end with your own. The board is 8x8.
A challenge mode approaches! You can battle your way through ranks of board game master beginning with a horrid smiling goblin and moving up to a mysterious old guru.
Two players can play the game through the Communication Cable, which is odd as it would seem feasible to play the games on a single system, but what can ya do?","这是两款经典益智游戏——五子棋与黑白棋的简单合集。
五子棋是一款古老的日本游戏，其名称意为“连成五子”。游戏目标是将你所选颜色（白色或黑色）的五颗棋子连成一线。当然，你的对手会试图阻止你。当一名玩家达成这一五子连珠的任务时，游戏结束。棋盘为14×14。
黑白棋通常以Pressman公司推广的名称“奥赛罗棋”为人所知。在黑白棋中，玩家的目标是通过用自己的棋子从两端包围对手的棋子（白色或黑色），将其翻转成自己的颜色。棋盘为8×8。
挑战模式来袭！你可以从一个咧嘴坏笑的小妖精开始，一路挑战各级棋盘游戏高手，直至挑战神秘的老宗师。
两名玩家可以通过通信线进行对战，不过在同一台设备上玩这些游戏似乎也可行，这有点奇怪，但也没办法啦。"
5b5e0195cd378c2dfa1568ce932428f2,Goraku Ou Tango! (Japan) (Rev 2).zip,Goraku Ou Tango!,娱乐王单词！,"Go Raku Ou Tango! is a simple word game mimicking the puzzles found in the pages of popular printed Japanese word-puzzle publisher Sekai Bunka. These puzzles consist of taking words writing in English and the two syllabaries of Japan Hiragana, or Katakana, and moving tiles around beneath the word(s) to recreate them in a different writing style. There are several variants on this gameplay.
There is a story mode featuring a family of archaeologists who are digging up Japanese orthography across the globe. Sweden, for instance, is known not only as being the home of lost Atlantis but also troves of buried Japanese writing! A family member is missing perhaps there will be clues in this the ruins of these global ancient Japanese ruins? By completing the puzzles you will get to see a scene and a new more difficult puzzle.","《娱乐王单词！》是一款简单的文字游戏，模仿了日本流行印刷文字谜题出版商“世界文化社”（Sekai Bunka）出版物中的谜题。这些谜题是将用英文以及日语的两种音节文字——平假名或片假名书写的单词，通过移动单词下方的字母块，以不同的书写形式重新组合这些单词。游戏玩法有几种不同的变体。

游戏中有一个故事模式，主角是一个考古学家家族，他们在全球各地挖掘日语文字。例如，瑞典不仅被认为是失落的亚特兰蒂斯的所在地，还埋藏着大量日语文字！有一名家族成员失踪了，也许在这些全球各地的古代日语遗迹中会有线索？通过完成谜题，你将看到一段剧情，并解锁一道更难的新谜题。"
a1d2a53c24556028194e560bec078da6,GunPey (Japan).zip,GunPey,西部炸弹消消乐,"Gunpey is a puzzle game set in the wild west. Your goal is to connect pieces of fuses to get one long fuse going across the board, making it explode and disappear. There are several game modes in Gunpey, such as the classical puzzle game modes ""Endless mode"", where you can either play until you mess up or timed, either for 2 or 5 minutes. ""Stage mode"", where you have to clear a certain amount of tiles before advancing to the next stage. ""Puzzle mode"", where you have a set amount of fuse pieces and you need to make them all go away in one explosion. And finally ""Vs. mode"", where you can face off against a friend.",《西部炸弹消消乐》是一款以狂野西部为背景的益智游戏。你的目标是连接导火索碎片，形成一条贯穿整个棋盘的长导火索，使其爆炸并消失。《西部炸弹消消乐》有多种游戏模式，例如经典的益智游戏模式“无尽模式”，你可以一直玩到失误为止，也可以选择限时模式，限时2分钟或5分钟。“关卡模式”中，你需要清除一定数量的方块才能进入下一关卡。“解谜模式”里，你会获得一定数量的导火索碎片，需要让它们在一次爆炸中全部消失。最后是“对战模式”，你可以与朋友一决高下。
02ed360e0d4cfdf45dd9d826163e21d1,Hanafuda Shiyouyo (Japan).zip,Hanafuda Shiyouyo,来玩花札吧,"Hanafuda Shiyouyo is an action based card game, published by Kaga Tech, which was released in Japan in 2000.",《来玩花札吧》是一款动作类卡牌游戏，由加贺科技公司发行，于2000年在日本发售。
f0e16f612fe2c6445eee893e17ba169d,Harobots (Japan) (Rev 1).zip,Harobots,哈罗机器人,"Harobots is a game series developed by Sunrise Interactive, it features Haro from Gundam series, as a protagonist's pet. Haro can be customized and battle for its trainer from any mecha series by Sunrise. This game series never released outside Japan due",《哈罗机器人》是由日出互动开发的游戏系列，游戏以《高达》系列中的哈罗为主角的宠物。哈罗可以进行定制，并为来自日出社任何机甲系列的训练师而战。由于某些原因，该游戏系列从未在日本以外地区发行。
