ID,FILE,NAME,NAME_ZH,DESC,DESC_ZH
6e35c403cfba89f19da7fc668fd13b7d,[BIOS] WonderSwan Boot ROM (Japan) (En).zip,ZZZ(notgame):[BIOS] WonderSwan Boot ROM,ZZZ（非游戏）：[BIOS] 万代神奇天鹅掌机启动ROM,,
b5643bf43001362ee8413fd671164348,15 Game (World) (Ja) (WonderWitch) (Unl).zip,15 Game (World) (Ja) (WonderWitch) (Unl),15数字拼图（世界版）（日版）（WonderWitch）（未授权）,,
9d7d5b097d20b2f031ccf4818ec863b0,15 Puzzle (World) (WonderWitch) (Unl).zip,15 Puzzle (World) (WonderWitch) (Unl),15拼图（世界版）（WonderWitch）（未授权版）,,
f90549fca537dac319f104aab62b9105,15 Puzzle for WW (World) (Ja) (WonderWitch) (Unl).zip,15 Puzzle for WW (World) (Ja) (WonderWitch) (Unl),世界版15拼图（日语版）（WonderWitch）（未授权）,,
d08b5a9e16800c330460d5802dbb796b,3D Mapping Tool (World) (v1.10) (WonderWitch) (Program) (Unl).zip,3D Mapping Tool (World) (v1.10) (WonderWitch) (Program) (Unl),3D地图绘制工具（世界版）（v1.10）（神奇女巫）（程序）（未授权）,,
7a78128ba6720115488dbd1159417285,7 Days Left (World) (Ja) (v1.00) (WonderWitch) (WWGP2002) (Unl).zip,7 Days Left (World) (Ja) (v1.00) (WonderWitch) (WWGP2002) (Unl),还剩7天（世界版）（日版）（1.00版）（WonderWitch）（WWGP2002）（未授权）,,
17c002c0939cfc1b212721f95edfa5bc,7 Days Left (World) (Ja) (v1.01) (WonderWitch) (Unl).zip,7 Days Left (World) (Ja) (v1.01) (WonderWitch) (Unl),仅剩7天（世界版）（日版）（1.01版）（WonderWitch制作）（未授权）,,
7a14e7cf2bf3456edf15f42b8e696912,Anchorz Field (Japan).zip,Anchor Field,锚地战场,"Anchorz Field is a Strategy game, developed and published by Sammy Studios, which was released in Japan in 1999.",《锚地战场》是一款策略游戏，由萨米工作室开发并发行，于1999年在日本发售。
55dbfbe175ff6527d393b8ed5f5dbaf3,Armored Unit (Japan).zip,Armored Unit,装甲部队,"Armored Unit is a WonderSwan exclusive sci-fi turn-based strategy game. Main gameplay modes are story mode, trial mode, and duel mode. In the story mode the player starts by selecting an armored unit out of several available which vary in type (i.e. knight, ranger, seeker), weapons, and basic stats such as health and energy, after which one progresses through a series of stages backed up by a short dialogue cut-scenes between the stages. The basic movement occurs on a square map field where you can move your armored unit horizontally or vertically. You fight an opponent which is a hidden armored unit, visible only when you are adjacent to it or if you have a radar that can uncover it within a certain radius. Armed with weapons and special attacks based on the type of unit you have selected your goal is to defeat the enemy unit and progress to the next stage. You can fight at random map fields or use weapons of mass destruction to try and hit enemy unit without knowing where exactly it is located. After each stage, you are able to upgrade and edit your current weapon arsenal, or add new weapons and gadgets.",《装甲部队》是一款仅在万代神奇天鹅掌机（WonderSwan）上推出的科幻回合制策略游戏。主要游戏模式包括故事模式、试炼模式和决斗模式。在故事模式中，玩家首先要从多个不同类型（如骑士、游骑兵、探索者）、配备不同武器且基础属性（如生命值和能量值）各异的装甲部队中选择一支，随后通过一系列关卡，关卡之间会穿插简短的对话过场动画。游戏的基本移动是在方形地图上进行的，玩家可以让装甲部队水平或垂直移动。玩家要对抗的敌方装甲部队处于隐藏状态，只有当你靠近它，或者你拥有能在一定半径内探测到它的雷达时，它才会显现。根据所选部队的类型，玩家可以使用武器和特殊攻击，目标是击败敌方部队并进入下一关卡。玩家可以在随机地图区域展开战斗，也可以使用大规模杀伤性武器，在不知道敌方部队确切位置的情况下尝试击中它。每通过一关，玩家都可以升级和编辑当前的武器库，或者添加新的武器和装备。
5b7ae2f6b167bde0024125a552cd9bbc,Bakusou Dekotora Densetsu for WonderSwan (Japan).zip,Bakusou Dekotora Densetsu,爆走デコトラ伝説（可音译为：爆走装饰卡车传说）,"You are a young man who lives in Japan and likes driving trucks. There is a competition of truck drivers who deliver goods all across the country. Willing to impress your girlfriend Yukie, you decide to participate in the races and to win the title of the best trucker in Japan.
Dekotora is short for ""decorated truck"", and this racing game consists not only of driving your truck through the highway, trying to be faster than your rivals, but also of buying various stuff for your truck and decorating it. Depending on your results in the races, you can buy truck parts and customize it the way you wish.","你是一个居住在日本、喜欢开卡车的年轻人。有一场面向全国送货卡车司机的比赛。为了给你的女友雪绘留下深刻印象，你决定参加比赛，赢得日本最佳卡车司机的称号。
“デコトラ（Dekotora）”是“装饰卡车”的简称，这款赛车游戏不仅包括驾驶你的卡车在高速公路上飞驰，试图比对手更快，还包括为你的卡车购买各种物品并进行装饰。根据你在比赛中的成绩，你可以购买卡车部件，并按照自己的意愿对其进行定制。"
d7e4a3bf1fdff69abc1b67cd28da8d22,Ball and Block (World) (WonderWitch) (Unl).zip,Ball and Block (World) (WonderWitch) (Unl),球与方块（世界版）（WonderWitch）（未授权）,,
e2e341ee81228bd648cdb5a4330d20d6,Balloon (World) (WonderWitch) (Unl).zip,Balloon (World) (WonderWitch) (Unl),气球（世界）（神奇女巫）（未发行）,,
0629e5084137773b550529bbf89dcd54,Battle Mosquito (World) (Ja) (WonderWitch) (Unl).zip,Battle Mosquito (World) (Ja) (WonderWitch) (Unl),战斗蚊子,,
10bac8480c3bbac2c69033a0891711a0,beatmania for WonderSwan (Japan).zip,Beatmania,太鼓达人（注：Beatmania一般指太鼓达人系列）,"This is a portable version of beatmania and as such it contains everything one could hope for in such a game, a series of music track (with reproduced vocals!), a lot of buttons to press, and a lot of vinyl to scratch.
After you select the music you want to play you'll have a vertical scroll which will indicate when you should hit one of the left directional buttons along with the music. The game also indicates when you should 'scratch' which should be be familiar to anyone who has played a beatmania arcade game. This refers to the scratching of a record, one might think that the WonderSwan is ill-equiped for such a for of input, well think again! beatmania for WonderSwan included in its packaging a miniature record that could be fitted over the right directional keys to  make scratching more realistic.
As you finish songs you'll on lock more difficult and interesting(?) tunes. The game plays vertically.","这是《太鼓达人》的便携版，因此它包含了此类游戏中人们所期望的一切元素：一系列音乐曲目（还有复刻的人声！）、大量待按的按键，以及大量可模拟刮擦的黑胶唱片效果。

在你选择想要演奏的音乐后，会出现一个垂直滚动条，它会提示你何时应配合音乐按下左侧的某个方向键。游戏还会提示你何时进行“刮擦”操作，玩过《太鼓达人》街机游戏的人对这个操作应该都很熟悉。这里的“刮擦”指的是黑胶唱片的刮擦音效。你可能会认为万代的WonderSwan掌机不太适合进行这种输入操作，那就再想一想吧！《万代WonderSwan版太鼓达人》的包装内附带了一个微型唱片，它可以套在右侧方向键上，让刮擦操作更具真实感。

当你完成歌曲演奏后，就能解锁更多难度更高且有趣（？）的曲目。该游戏以纵向画面进行游玩。"
1e208669ed13ed4d29b1747f9e388199,Buffers Evolution (Japan).zip,Buffers Evolution,强化进化,"In a post-apocalyptic future a gambling syndicate seeks to make a quick buck in the gritty remains of earth. By fusing the best of animal and mechanical traits they create three bestial androids from a bird, a lion, and a rhinoceros. Bets are taken and then the robots are loosed into hostile mazes of scrap metal on old earth. Maybe they'll even make it back alive...
The goal of BUFFERS EVOLUTION is to run through a course while collecting ten parts in the best time possible. The courses are large and vary between jungle scenes, deserts, old factories, and general mechanical wastes. These areas are cased in by electricity to stop the contests from escaping and thereby ruining the entertainment of the masses. This will keep you in the bounds of the course. With the press of a button your character will momentarily turn into a 'buffer', a sharp pisiform metallic object, while being a buffer you can destroy enemies by slamming into them, this will often bounce you in a given direction, which is useful for reaching high ledges. 
Although you do not need to get all the parts to clear an area special items can be accrued by collection parts, while on the course proper these parts will heal any damage you may have taken. Perhaps if you collect all the part in all nine areas you'll have the means to escape you captors? 
Gameplay is reminiscent of Sonic the Hedghog
 although in those games you race against a countdown while here you are merely trying to get good times.","在一个后启示录的未来，一个赌博集团试图在地球的残垣断壁中快速捞一笔。他们将动物和机械的最佳特性融合在一起，从鸟类、狮子和犀牛的特征创造出了三个野兽型机器人。人们下好赌注后，这些机器人就会被放入旧地球上由废金属构成的危险迷宫中。也许它们甚至能活着回来……
《强化进化》的目标是在尽可能短的时间内跑过赛道并收集十个零件。赛道很大，场景包括丛林、沙漠、旧工厂和一般的机械废墟。这些区域被电流包围，以防止参赛者逃脱，从而破坏大众的娱乐体验。这会让你始终在赛道范围内。按下按钮，你的角色会瞬间变成一个“强化体”，一个尖锐的豌豆形金属物体，变成强化体时，你可以通过撞击来摧毁敌人，这通常会让你向某个方向反弹，这对到达高处的平台很有用。
虽然你不需要收集所有零件就能通关一个区域，但通过收集零件可以获得特殊物品，在赛道上，这些零件会治愈你可能受到的任何伤害。也许如果你在所有九个区域都收集到了所有零件，你就有办法摆脱囚禁你的人了？
游戏玩法让人想起《刺猬索尼克》，不过在那些游戏中你是与倒计时赛跑，而在这里你只是试图跑出好成绩。"
147b57759140354a87951208b7c98aa1,Cardcaptor Sakura - Sakura to Fushigi na Clow Card (Japan).zip,Cardcaptor Sakura : Sakura to Fushigi na Clow Card,魔卡少女樱：小樱与神秘的库洛牌,"Card Captor Sakura: Sakura to Fushigi na Clow Card is a Role-Playing game, developed by Sims and published by Bandai, which was released in Japan in 1999.",《魔卡少女樱：小樱与神秘的库洛牌》是一款角色扮演游戏，由Sims开发，万代发行，于1999年在日本发售。
4d93e7e76250063538d33f43fa6602ff,Castle (World) (WonderWitch) (Unl).zip,Castle (World) (WonderWitch) (Unl),城堡（世界版）（神奇女巫）（未授权版）,,
0374cf0e0b2838f44e23937c9cdf127f,Cave Flyer (World) (Proto 1) (WonderWitch) (Unl).zip,Cave Flyer (World) (Proto 1) (WonderWitch) (Unl),洞穴飞行者（世界版）（原型1）（WonderWitch）（未发行）,,
89691f80b418a1683ed91b28bbc59091,Cave Flyer (World) (Proto 2) (WonderWitch) (WWGP2001) (Unl).zip,Cave Flyer (World) (Proto 2) (WonderWitch) (WWGP2001) (Unl),洞穴飞行者（世界版）（原型2）（WonderWitch）（WWGP2001）（未发行）,,
1b11ff02535c5f91add50c082a84b996,Chaos Gear - Michibikareshi Mono (Japan).zip,Chaos Gear : Michibikareshi Mono,混沌齿轮：被引导之人,"Chaos Gear: Michibikareshi Mono is a Strategy game, developed by Lay-Up and published by Bandai, which was released in Japan in 1999.",《混沌齿轮：被引导之人》是一款策略游戏，由Lay-Up开发，万代发行，于1999年在日本发售。
362e024522bc61b9a62086b7544f53b7,Chocobo no Fushigi na Dungeon for WonderSwan (Japan) (Rev 1).zip,Chocobo no Fushigi na Dungeon for WonderSwan,陆行鸟不可思议的迷宫 幻想天鹅版,"This is the first game in the Chocobo's Dungeon series.  You take on the character of Chocobo and adventure through a randomly created dungeon.
The story evolves from the opening movie when a fellow chocobo is ""turned"" evil by a crystal he finds in a garden.  When the evil chocobo kicks you into a dungeon, the adventure begins.  Travel through an ever changing dungeon, collecting items and weapons to become more powerful, so you can defeat the increasingly difficult enemies.","这是陆行鸟迷宫系列的首款游戏。你将扮演陆行鸟，在随机生成的迷宫中展开冒险。
故事从开场动画开始，一只陆行鸟在花园里捡到一颗水晶后“变”坏了。当这只邪恶的陆行鸟把你踢进迷宫时，冒险便拉开了帷幕。在不断变化的迷宫中穿梭，收集物品和武器以增强实力，这样你就能击败越来越强大的敌人。"
8da08c1d33202f7635fb4504e02eb523,Chou Aniki - Otoko no Tamafuda (Japan) (Rev 4).zip,Chou Aniki : Otoko no Tamafuda,超兄贵：男人的弹珠卡,"Cho Aniki makes it's first appearance in a handheld console with Cho Aniki: Otoko no Tamafuda, only this time the game isn't a 2D shooter developed by Masaya, but instead a card-fighting RPG.
You select your character from a roster of Cho Aniki characters and set out to explore it's funky body-building universe and challenge the many npcs for a few rounds of card combat. Win and you get to increase your collection. Special cards can be unlocked by defeating another player in the vs. mode.","《超兄贵：男人的弹珠卡》让超兄贵首次登陆掌机平台，只不过这次的游戏并非由 Masaya 开发的 2D 射击游戏，而是一款卡牌对战 RPG。
你可以从超兄贵角色列表中选择你的角色，然后出发探索这个奇特的健身世界，并与众多 NPC 进行几轮卡牌对战。获胜后，你就能增加你的卡牌收藏。在对战模式中击败其他玩家，还能解锁特殊卡牌。"
0e42223262c76de817932a6907c0c92b,Clock Tower for WonderSwan (Japan) (Rev 1).zip,Clock Tower,钟楼,"Jennifer and her friends are adopted by a nice lady named Mary one day. They expect to be going to a wonderful new home, at the Barrows Mansion. There they will live with Mary and Mr. Barrows. Unfortunately, something goes terribly wrong and Jennifer's friends are showing up dead one by one.  While this is happening, Mary is missing and Jennifer ends up being chased by a crazed psychopath known only as...Scissorman. 
Now she must survive and get out of the mansion in this point-and-click horror adventure... Being a teenage girl, you have no special abilities at all, just your wits and your will to survive, there are a few enemies that can kill you instantly, but Scissorman is the true horror that will give you trouble.",一天，珍妮弗和她的朋友们被一位名叫玛丽的善良女士收养。他们期待着前往位于巴罗斯庄园的美好新家。在那里，他们将与玛丽和巴罗斯先生一起生活。不幸的是，事情变得糟糕透顶，珍妮弗的朋友们一个接一个地死去。与此同时，玛丽失踪了，珍妮弗最终被一个只被称为……剪刀男的疯狂精神病患者追赶。现在，在这场点击式恐怖冒险中，她必须存活下来并逃离这座庄园……作为一个少女，你完全没有特殊能力，只有你的智慧和求生的意志。有几个敌人可以瞬间杀死你，但剪刀男才是真正会给你带来麻烦的恐怖存在。
472970a80164fcd03c21539aa2441880,Crazy Climber (Japan).zip,Crazy Climber,疯狂攀爬者,"Dans la peau de Crazy Climber, grimpez jusqu'au sommet d'une série de bâtiments, où un hélicoptère vous attend pour vous récupérer et vous emmener au bâtiment suivant. Lorsque Climber escalade un bâtiment, il est capable de monter et de se déplacer latéralement, mais il ne peut pas descendre. 
Pendant l'escalade d'un bâtiment, les fenêtres s'ouvrent et se ferment simultanément. Si une fenêtre se ferme sur l'une de ses mains, il perd sa prise. Cependant, si une fenêtre se ferme sur ses deux mains, il tombera et mourra, ce qui entraînera la perte d'une vie. Vous disposez de trois grimpeurs au total, mais un grimpeur supplémentaire vous est attribué tous les 30 000 points.","化身为疯狂攀爬者，攀登一系列建筑物的顶端，那里有一架直升机等着接您并带您前往下一座建筑。当攀爬者攀爬建筑物时，他可以向上和横向移动，但不能向下移动。
在攀爬建筑物的过程中，窗户会同时打开和关闭。如果一扇窗户在他的一只手上关闭，他就会失去抓力。然而，如果一扇窗户在他的两只手上关闭，他就会掉落并死亡，这将导致失去一条生命。您总共拥有三名攀爬者，但每获得30000分就会额外获得一名攀爬者。"
047ceafc9a5092403192d4850ff06ad0,Dash Straight (World) (Ja) (WonderWitch) (Unl).zip,Dash Straight (World) (Ja) (WonderWitch) (Unl),直线冲刺（世界版）（日版）（WonderWitch）（未授权）,,
cd765e832612da6fb344faa1b73edaec,Densha de Go! (Japan) (Rev 1).zip,Densha de Go!,火车GO！,"Based on the 1996 arcade game, Densha de Go! was one of the first commercial train-driving simulation games, and went on to spawn numerous successors.
The player can choose from a variety of tracks and trains and will then have to drive the train to the designated stations while sticking to the tight schedule, stopping exactly at the marked positions, obeying all signs and signals, and ensuring passenger safety and comfort.
Whenever the player makes a mistake, points are deducted from a counter which at the start of each round is initialized to a value depending on the selected difficulty. If it reaches zero, the game is over.
The following lines are featured:
1. Sagano Main Line (Sanin Line) from Kameoka to Kyoto
2. Keihin-Tohoku Line from Shinagawa to Yokohama
3. Tokaido Main Line (JR Kyoto Line) from Kyoto to Osaka
4. Yamanote Line (Inner Circle) from Shibuya to Tokyo Station
5. Tokaido Main Line EX from Takatsuki to Osaka, part of the rapid Tokaido Main Line from the original version, but this time with stops at every station (Windows only)
6. Sagano Line EX from Kameoka to Kyoto, without the shortcut from Saga-Arashiyama to Tambaguchi from the original version (Windows only)","《火车GO！》基于1996年的街机游戏，是最早的商业火车驾驶模拟游戏之一，并衍生出了众多后续作品。
玩家可以从各种轨道和火车中进行选择，然后必须驾驶火车前往指定车站，同时要严格遵守紧凑的时刻表，精确停靠在标记位置，遵守所有标志和信号，并确保乘客的安全与舒适。
每当玩家犯错时，会从一个计数器中扣除分数，该计数器在每一轮开始时会根据所选难度初始化为一个值。如果计数器归零，游戏就结束了。
游戏中包含以下线路：
1. 从龟冈到京都的嵯峨野本线（山阴本线）
2. 从品川到横滨的京滨东北线
3. 从京都到大阪的东海道本线（JR京都线）
4. 从涩谷到东京站的山手线（内环线）
5. 从高槻到大阪的东海道本线EX，是原版快速东海道本线的一部分，但这次每站都停（仅Windows版）
6. 从龟冈到京都的嵯峨野线EX，没有原版中从嵯峨岚山到丹波口的捷径（仅Windows版）"
37857de31f2ac445314d44094d1f0342,Densha de Go! 2 (Japan).zip,Densha de Go! 2,火车GO！2,"The 1998 sequel of the popular Japanese train driving game by Taito has once again been ported to various home systems. For the first time on the PlayStation, it is possible to drive through the snow, and take a seat in the cockpit of a Shinkansen bullet train.
The gameplay is more arcade than simulation. The focus is on stopping at the stations at the perfect moment and position, keeping up with the schedule, obeying signals and speed limits, and ensuring the safety and comfort of the passengers. Mistakes result in points being deducted from a counter. If it reaches 0, the game is over.
The following routes are available:
1. Hokuhoku Line from Naoetsu to Uragawara
2. Tohoku Shinkansen from Morioka to Shin-Hanamaki
3. Akita Shinkansen from Akita to Omagari
4. Keihin-Tohoku Line from Shinagawa to Ueno
5. Osaka Loop Line from Osaka to Tennoji (not in the Arcade original)
6. Kagoshima Main Line from Hakata to Kokura (only in PlayStation and Windows versions)","这款由太东公司推出的热门日本火车驾驶游戏于1998年推出了续作，并再次被移植到了多个家用游戏平台。在 PlayStation 上，玩家首次可以驾驶火车穿越雪景，还能坐上新干线子弹头列车的驾驶舱。
游戏玩法更偏向街机风格，而非模拟。游戏重点在于在完美的时刻和位置停靠车站、按时运行、遵守信号灯和限速规定，以及确保乘客的安全与舒适。失误会导致计分器扣分。若分数归零，游戏即结束。
游戏提供以下线路：
1. 从直江津到浦川原的北北线
2. 从盛冈到新花卷的东北新干线
3. 从秋田到大森的秋田新干线
4. 从品川到上野的京滨东北线
5. 从大阪到天王寺的大阪环状线（街机原版中没有此线路）
6. 从博多到小仓的鹿儿岛本线（仅 PlayStation 和 Windows 版本中有此线路）"
c6b60df3128ac36c1efcc93fb9e74ac6,Digimon - Ver. WonderSwan (Hong Kong) (En).zip,Digimon - Ver. WonderSwan,数码宝贝 - WonderSwan版,Digimon Ver. WonderSwan is a Japanese handheld version of the original Tamagotchi-like Digimon pet for the WonderSwan. It includes all of the original Digimon from the five different pet devices. In this game the player can have up to five different Digim,《数码宝贝 WonderSwan版》是一款为WonderSwan掌机打造的日式掌机游戏，其原型是类似电子鸡的数码宝贝宠物养成游戏。它包含了五款不同宠物设备中的所有原始数码宝贝。在这款游戏中，玩家最多可以拥有五只不同的数码兽
84999562e3e017d24f53fc45bd9bad15,Digimon Adventure - Anode Tamer (Japan) (Rev 1).zip,Digimon Adventure : Anode Tamer,数码宝贝大冒险：阳极驯兽师,"The game is based on the popular manga series Digimon, which follows the adventures of children who can gain access into the digital world and fight digital monsters there. In this game, the evil Milenniamon has kidnapped several children and is planning to take control over the Digiworld. One of the good monsters, Agumon, escaped, and transported the hero Ryou to the Digiworld. Now Ryou has to fight monsters, capture them, and assemble an army to overthrow Milenniamon and to rescue his friends.
The gameplay involves mainly hunting monsters in dungeons and then sending them to fight other monsters. In the town you can buy supplies and take care of your monsters. The battles are turn-based, and you can move freely over the battle field. Once a contact with an enemy is initiated, an automatic battle sequence follows.","这款游戏基于热门漫画系列《数码宝贝》改编，讲述了孩子们进入数码世界并与数码怪兽战斗的冒险故事。在这款游戏中，邪恶的千年兽绑架了几名儿童，并计划控制数码世界。善良的数码兽之一亚古兽逃脱后，将主角辽传送到了数码世界。现在，辽必须与怪兽战斗、捕捉它们，并组建一支军队来推翻千年兽，拯救他的朋友们。
游戏玩法主要包括在地下城狩猎怪兽，然后派它们与其他怪兽战斗。在城镇中，你可以购买补给品并照顾你的怪兽。战斗采用回合制，你可以在战场上自由移动。一旦与敌人接触，就会触发自动战斗序列。"
